{
  "schema": "ecpa-workshop-mod-corpus/v1",
  "observed_at": "2026-09-21T00:00:00+08:00",
  "authority": "vLLM-HUST plugin page workshop metadata",
  "population": {
    "repository": "vLLM-HUST/vllm-hust-website",
    "repository_id": 1141990731,
    "node_id": "R_kgDORBFlSw",
    "default_branch": "main",
    "commit_sha": "8336f5b67c69910aa7d5dfc3b5b94407e99928bd",
    "metadata_path": "data/plugin-workshop-metadata.json",
    "metadata_snapshot_path": "docs/corpus/plugin-workshop-metadata.snapshot.json",
    "metadata_blob_sha": "04b6d4a23f62ba5fc4b3d53dff5a712b117560f2",
    "metadata_sha256": "94164486d075671dde0e2992557d5117073644c402054be518673cea68bbd08e",
    "source_rows_sha256": "aabd0a6dbd49e2314c816e115fe90307a1e2e085e91665eb5a8ec672c2625adf",
    "audit_rows_sha256": "be253c011bc72e159a8390cea9cc1ba3d615468672ce1019c8c4475358301c4e",
    "mod_count": 24
  },
  "counts": {
    "mods": 24,
    "ecpa_bundle_namespace": 16,
    "namespace_mismatch": 1,
    "general_plugin_only": 3,
    "direct_or_non_entry_integration": 2,
    "source_only": 2,
    "package_projects": 22,
    "local_package_build_pass": 21,
    "local_tests_pass": 17,
    "environment_blocked": 5,
    "no_automated_tests": 2
  },
  "mods": [
    {
      "id": "bidkv",
      "repository": "vLLM-HUST/vllm-hust-bidkv",
      "repository_id": 1240350965,
      "node_id": "R_kgDOSe5A9Q",
      "visibility": "public",
      "default_branch": "main",
      "head_commit": "a0cba97d9abdc99908e46616db622f0e0099127f",
      "integration_class": "ecpa_bundle_namespace",
      "bundle_id": "org.vllm-hust.bidkv",
      "package_build": "pass",
      "local_test": "pass",
      "test_summary": "385 passed, 25 skipped",
      "evidence_class": "source-package-cpu-only"
    },
    {
      "id": "diffspec",
      "repository": "vLLM-HUST/vllm-ascend-hust-diffspec",
      "repository_id": 1308319970,
      "node_id": "R_kgDOTftg4g",
      "visibility": "public",
      "default_branch": "main",
      "head_commit": "42e5909fc6fe276ba0defe1901257a523653aefb",
      "integration_class": "ecpa_bundle_namespace",
      "bundle_id": "org.vllm-hust.diffspec",
      "package_build": "pass",
      "local_test": "environment_blocked",
      "test_summary": "collection blocked by absent Ascend HCCL runtime after host import",
      "evidence_class": "source-package-cpu-only"
    },
    {
      "id": "vspec",
      "repository": "vLLM-HUST/vllm-hust-vSpec",
      "repository_id": 1369166618,
      "node_id": "R_kgDOUZvTGg",
      "visibility": "public",
      "default_branch": "main",
      "head_commit": "c5c4cf9b4d26f2a13049a7289e3a8e2feca93e10",
      "integration_class": "ecpa_bundle_namespace",
      "bundle_id": "org.vllm-hust.vspec",
      "package_build": "pass",
      "local_test": "environment_blocked",
      "test_summary": "collection blocked by absent vllm_ascend / Ascend HCCL runtime",
      "evidence_class": "source-package-cpu-only"
    },
    {
      "id": "latchmoe",
      "repository": "vLLM-HUST/vllm-ascend-hust-LatchMoE",
      "repository_id": 1312701873,
      "node_id": "R_kgDOTj49sQ",
      "visibility": "public",
      "default_branch": "main",
      "head_commit": "9b2d4acdbfbe6463a22dd0bb8e6ca5bfda47e2c1",
      "integration_class": "ecpa_bundle_namespace",
      "bundle_id": "org.vllm-hust.latchmoe",
      "package_build": "pass",
      "local_test": "environment_blocked",
      "test_summary": "collection blocked by absent vllm_ascend runtime",
      "evidence_class": "source-package-cpu-only"
    },
    {
      "id": "ascend-adaptive-quantized-kv",
      "repository": "vLLM-HUST/vllm-ascend-adaptive-quantized-kv-hust",
      "repository_id": 1352499736,
      "node_id": "R_kgDOUJ2CGA",
      "visibility": "private",
      "default_branch": "main",
      "head_commit": "8587845f29d70256103990ed6492837ddaf5a800",
      "integration_class": "ecpa_bundle_namespace",
      "bundle_id": "org.vllm-hust.ascend-adaptive-quantized-kv",
      "package_build": "pass",
      "local_test": "pass",
      "test_summary": "36 passed, 2 skipped",
      "evidence_class": "source-package-cpu-only"
    },
    {
      "id": "ascend-quant-runtime-descriptor",
      "repository": "vLLM-HUST/vllm-ascend-quant-hust",
      "repository_id": 1239477727,
      "node_id": "R_kgDOSeDt3w",
      "visibility": "public",
      "default_branch": "main",
      "head_commit": "f161daab91b2b558bc8ee65d2b1bc76cd78e00b6",
      "integration_class": "ecpa_bundle_namespace",
      "bundle_id": "org.vllm-hust.ascend-quant-runtime",
      "package_build": "pass",
      "local_test": "pass",
      "test_summary": "7 passed; 6 warnings",
      "evidence_class": "source-package-cpu-only"
    },
    {
      "id": "kvcompress-ascend",
      "repository": "vLLM-HUST/vllm-ascend-kvcompress-hust",
      "repository_id": 1349304370,
      "node_id": "R_kgDOUGzAMg",
      "visibility": "public",
      "default_branch": "master",
      "head_commit": "de038e7010818532ab2e634c85d2c6fbd4e3028c",
      "integration_class": "ecpa_bundle_namespace",
      "bundle_id": "org.vllm-hust.ascend-kvcompress",
      "package_build": "pass",
      "local_test": "environment_blocked",
      "test_summary": "110 passed, 1 skipped; 4 cells blocked by NPU device registration, host version, or absent HCCL",
      "evidence_class": "source-package-cpu-only"
    },
    {
      "id": "kv-tiering-migration",
      "repository": "vLLM-HUST/vllm-hust-kv-tiering",
      "repository_id": 1353153014,
      "node_id": "R_kgDOUKd59g",
      "visibility": "public",
      "default_branch": "main",
      "head_commit": "3a73c7e1628801ea5d4f585bcc9d06260161a78c",
      "integration_class": "source_only",
      "bundle_id": null,
      "package_build": "not_applicable",
      "local_test": "no_automated_tests",
      "test_summary": "source scaffold contains no automated tests",
      "evidence_class": "source-package-cpu-only"
    },
    {
      "id": "knorm-migration",
      "repository": "vLLM-HUST/vllm-hust-knorm",
      "repository_id": 1353153054,
      "node_id": "R_kgDOUKd6Hg",
      "visibility": "public",
      "default_branch": "main",
      "head_commit": "e0e872abfc9fa88659b3e83c1c8b8b2b3de88fc0",
      "integration_class": "source_only",
      "bundle_id": null,
      "package_build": "not_applicable",
      "local_test": "no_automated_tests",
      "test_summary": "source scaffold contains no automated tests",
      "evidence_class": "source-package-cpu-only"
    },
    {
      "id": "pyramidkv-ascend-migration",
      "repository": "vLLM-HUST/vllm-ascend-pyramidkv-hust",
      "repository_id": 1353153104,
      "node_id": "R_kgDOUKd6UA",
      "visibility": "public",
      "default_branch": "main",
      "head_commit": "77b0862c1e5be8c883fda934cdb383c57cf7ad0d",
      "integration_class": "ecpa_bundle_namespace",
      "bundle_id": "org.vllm-hust.ascend-pyramidkv",
      "package_build": "pass",
      "local_test": "pass",
      "test_summary": "33 passed after installing the exact local wheel",
      "evidence_class": "source-package-cpu-only"
    },
    {
      "id": "quantized-kv-cache-migration",
      "repository": "vLLM-HUST/vllm-ascend-quantized-kv-cache-hust",
      "repository_id": 1353209778,
      "node_id": "R_kgDOUKhXsg",
      "visibility": "public",
      "default_branch": "main",
      "head_commit": "275950ef954309a4f3cdb261594f16b303d399bf",
      "integration_class": "general_plugin_only",
      "bundle_id": null,
      "package_build": "pass",
      "local_test": "pass",
      "test_summary": "8 passed, 2 skipped",
      "evidence_class": "source-package-cpu-only"
    },
    {
      "id": "simllm-migration",
      "repository": "vLLM-HUST/vllm-ascend-simllm-hust",
      "repository_id": 1353209850,
      "node_id": "R_kgDOUKhX-g",
      "visibility": "public",
      "default_branch": "main",
      "head_commit": "dcdc6edf7bdcc68bdf35058888ebfd9752ae3566",
      "integration_class": "ecpa_bundle_namespace",
      "bundle_id": "org.vllm-hust.simllm",
      "package_build": "pass",
      "local_test": "pass",
      "test_summary": "5 passed",
      "evidence_class": "source-package-cpu-only"
    },
    {
      "id": "unified-communication-migration",
      "repository": "vLLM-HUST/vllm-hust-unified-comm",
      "repository_id": 1353209920,
      "node_id": "R_kgDOUKhYQA",
      "visibility": "public",
      "default_branch": "main",
      "head_commit": "f00d1ef4c19a992d67ef8012952a9405d52dd447",
      "integration_class": "ecpa_bundle_namespace",
      "bundle_id": "org.vllm-hust.unified-communication",
      "package_build": "pass",
      "local_test": "pass",
      "test_summary": "4 passed",
      "evidence_class": "source-package-cpu-only"
    },
    {
      "id": "split-batch-full-graph-migration",
      "repository": "vLLM-HUST/vllm-ascend-split-batch-hust",
      "repository_id": 1353209990,
      "node_id": "R_kgDOUKhYhg",
      "visibility": "public",
      "default_branch": "main",
      "head_commit": "b46de46e90204a0a7636a1dbc952f73178859ada",
      "integration_class": "ecpa_bundle_namespace",
      "bundle_id": "org.vllm-hust.split-batch-full-graph",
      "package_build": "pass",
      "local_test": "pass",
      "test_summary": "4 passed",
      "evidence_class": "source-package-cpu-only"
    },
    {
      "id": "kv-transfer-observability-migration",
      "repository": "vLLM-HUST/vllm-hust-kv-transfer-observability",
      "repository_id": 1353210072,
      "node_id": "R_kgDOUKhY2A",
      "visibility": "public",
      "default_branch": "main",
      "head_commit": "53e69013dcf27fd08a93d142288c93c701edabd3",
      "integration_class": "ecpa_bundle_namespace",
      "bundle_id": "org.vllm-hust.kv-transfer-observability",
      "package_build": "pass",
      "local_test": "pass",
      "test_summary": "125 passed",
      "evidence_class": "source-package-cpu-only"
    },
    {
      "id": "layered-prefill-migration",